{
  "schema": "ophiolite.well-residual/1",
  "representation": "normalized",
  "source": {
    "authority": "ophiolite:uploaded",
    "key": "synthetic-well-residual",
    "revision": "7fb0a64733861e079ef869052c37e92f124e40879bb46389c2a2396fc7a850f2",
    "profile": "well-residual/1"
  },
  "source_sha256": "7fb0a64733861e079ef869052c37e92f124e40879bb46389c2a2396fc7a850f2",
  "interpretation": {
    "reader": "asset_connectors.typed_reader/1",
    "mapping": "well-residual/1",
    "parsing_policy": "typed-strict/1",
    "null_policy": "empty cell or declared NODATA value is missing; never zero-filled"
  },
  "context": {
    "type": "well-residual",
    "count": 3,
    "computed": 1,
    "not_computed": 2,
    "members": 3,
    "members_not_computed": 2,
    "formation": "DCC",
    "display_unit": "m",
    "fidelity": {
      "status": "assessed",
      "preserved": [
        "rows in order",
        "the formation, the display unit and the surface",
        "crossings and residuals as written"
      ],
      "losses": [
        "Text formatting (whitespace, quoting, line endings, number spelling) is kept only in the exact original"
      ],
      "unknown_context": []
    }
  },
  "surface": {
    "asset_id": "synthetic-grid",
    "revision": "5555555555555555555555555555555555555555555555555555555555555555"
  },
  "rows": [
    {
      "wellbore": "wellbore-1a2b3c4d5e6f708192a3b4c5d6e7f809",
      "occurrence": 1,
      "top": {
        "asset_id": "synthetic-tops",
        "revision": "3333333333333333333333333333333333333333333333333333333333333333",
        "index": 0,
        "md": 1250.5
      },
      "trajectory": {
        "asset_id": "synthetic-trajectory",
        "revision": "1111111111111111111111111111111111111111111111111111111111111111"
      },
      "crossings": [
        {
          "md": 1248.25,
          "low": 1248.245,
          "high": 1248.255
        }
      ],
      "used": 0,
      "residual": 2.25,
      "unit": "m",
      "reason": null,
      "between": null
    },
    {
      "wellbore": "wellbore-2b3c4d5e6f708192a3b4c5d6e7f8091a",
      "occurrence": 1,
      "top": {
        "asset_id": "synthetic-tops-2",
        "revision": "4444444444444444444444444444444444444444444444444444444444444444",
        "index": 2,
        "md": 1302.0
      },
      "trajectory": {
        "asset_id": "synthetic-trajectory-2",
        "revision": "2222222222222222222222222222222222222222222222222222222222222222"
      },
      "crossings": [],
      "used": null,
      "residual": null,
      "unit": "m",
      "reason": "grazing",
      "between": [
        1301.2,
        1301.9
      ]
    },
    {
      "wellbore": "wellbore-3c4d5e6f708192a3b4c5d6e7f8091a2b",
      "occurrence": 0,
      "top": null,
      "trajectory": null,
      "crossings": [],
      "used": null,
      "residual": null,
      "unit": "m",
      "reason": "no-top",
      "between": null
    }
  ]
}
